{
  "$schema": "https://json-schema.org/draft/2020-12/schema",
  "$id": "https://mere.run/contracts/terminal-bench-recipe.v1.schema.json",
  "title": "mere.run Terminal-Bench Recipe v1",
  "type": "object",
  "additionalProperties": false,
  "required": [
    "contractVersion",
    "id",
    "harness",
    "dataset",
    "agent",
    "inference",
    "defaults",
    "models"
  ],
  "properties": {
    "contractVersion": {
      "const": "mere.run/terminal-bench-recipe.v1"
    },
    "id": {
      "type": "string",
      "pattern": "^[a-z0-9-]+$"
    },
    "harness": {
      "type": "object",
      "additionalProperties": false,
      "required": ["name", "version"],
      "properties": {
        "name": { "const": "harbor" },
        "version": { "type": "string" }
      }
    },
    "dataset": {
      "type": "object",
      "additionalProperties": false,
      "required": ["name", "ref", "sourceRepo", "sourceCommit", "taskCount"],
      "properties": {
        "name": { "type": "string" },
        "ref": { "type": "string", "pattern": "^sha256:[0-9a-f]{64}$" },
        "sourceRepo": { "type": "string", "format": "uri" },
        "sourceCommit": { "type": "string", "pattern": "^[0-9a-f]{40}$" },
        "taskCount": { "type": "integer", "minimum": 1 }
      }
    },
    "agent": {
      "type": "object",
      "additionalProperties": false,
      "required": ["name", "temperature", "summarization"],
      "properties": {
        "name": { "const": "terminus-2" },
        "temperature": { "type": "number", "minimum": 0 },
        "summarization": { "type": "boolean" }
      }
    },
    "inference": {
      "type": "object",
      "additionalProperties": false,
      "required": ["engine", "memoryGuard", "contextSize", "maxOutputTokens", "maxActiveRequests"],
      "properties": {
        "engine": { "type": "string" },
        "memoryGuard": { "const": "balanced" },
        "contextSize": { "type": "integer", "minimum": 1 },
        "maxOutputTokens": { "type": "integer", "minimum": 1 },
        "maxActiveRequests": { "type": "integer", "minimum": 1 }
      }
    },
    "defaults": {
      "type": "object",
      "additionalProperties": false,
      "required": ["attemptsPerTask", "concurrency", "maximumAdditionalStorageGiB"],
      "properties": {
        "attemptsPerTask": { "type": "integer", "minimum": 1 },
        "concurrency": { "type": "integer", "minimum": 1 },
        "maximumAdditionalStorageGiB": { "type": "number", "exclusiveMinimum": 0 }
      }
    },
    "models": {
      "type": "array",
      "minItems": 1,
      "uniqueItems": true,
      "items": { "type": "string", "minLength": 1 }
    }
  }
}
